{
  "fixture_class": "CONTRACT_ONLY_SYNTHETIC_NO_REAL_PROMOTION",
  "candidate_version": "1.0.0",
  "evidence_class": "SYNTHETIC_CONTRACT_ONLY",
  "provider_outcome": "FAILED",
  "provider_result_origin": "UNAVAILABLE",
  "envelope_contract_valid": true,
  "bundle_contract_valid": true,
  "reference_identity_valid": true,
  "evaluation_state": "NOT_APPLICABLE",
  "evaluation_contract_valid": false,
  "adjudication_complete": false,
  "severe_hallucination_unresolved": false,
  "threshold_status": "PROPOSED_NOT_APPROVED",
  "provider_qualification_state": "NOT_PROVIDER_QUALIFICATION",
  "human_review_state": "NOT_AUTHORIZED",
  "product_promotion_authority": false,
  "demo_fallback_policy": "USER_EXPLICIT_OUT_OF_ENVELOPE_ONLY",
  "reference_id": "t9-synthetic-reference-11"
}
